invoice_id,title,quantity,price,discount,description
10001,Huawei Honor 6X Dual Camera Unlocked Smartphone 32GB Gray,3,179.99,0,"Dual Lenses Deliver Professional-Grade Images. More Filters, More Creativity, More Memories to Share. Vivid Photos."
10001,Microsoft Lumia 435 8GB 4G Unlocked GSM Windows Smartphone,2,49.98,0,"4.0-inch Capacitive Touchscreen, 480 x 800 pixel resolution. Microsoft Windows 8.1, planned upgrade to Windows 10; Chipset: Qualcomm MSM8210 Snapdragon 200, Processor: Dual-Core 1.2 GHz Cortex-A7, GPU: Adreno 302."
10002,LG G2 D800 GSM 4G LTE Unlocked Smartphone with 13MP Camera 32GB Black,1,137.99,0,"5.2"" True HD-IPS + LCD Capacitive Multi-Touchscreen w/ Protective Corning Gorilla Glass 2. Android v4.2.2 JellyBean, Quad-Core 2.26 GHz Krait 400 Processor, Chipset: Qualcomm MSM8974 Snapdragon 8, Adreno 330 Graphics."
10002,Porsche Design Huawei Mate 9 Luxury Edition 256GB,5,1669.9,100,"5.5"" Curved AMOLED Display; HUAWEI Kirin 960, Octa-core CPU (4 x 2.4 GHz A73+ 4 x 1.8 GHz A53) + i6 co-processor, Mali-G71 MP8; 6GB RAM + 256GB ROM"
10002,24ct Gold iPhone 6S 4.7-inch 128gb Unlocked and Brand New,1,1599,50,Original Apple iPhone 6S 128gb Unlocked; Plated in REAL 24ct Gold with Certificate
10002,Huawei Mate S Unlocked Smartphone 5.5 Inch Hisilicon Kirin 935 Octa Core 2.2GHz,1,1269.99,0,"Kirin 935 EMUI 3.1, octa Core 4 x 2.2GHz + 4 x 1.5GHz; 5.5 inch Capacitive, FHD screen"
10002,Apple iPhone 7 256GB 4G LTE GSM - Gold,10,1050,0,"4.7 -inch (diagonal) Retina HD display with 1334 -by-750 resolution and wide color; 12MP camera, optical image stabilization, Quad-LED True Tone flash, and Live Photos; A9 Fusion chip with integrated M9 motion coprocessor"
10003,Huawei P10 Plus VKY-L29 Single SIM 128GB,2,777,0,"HUAWEI P10 PLUS SINGLE SIM 5.5"" INCH ANDROID FACTORY UNLOCKED 4G/LTE SMARTPHONE"
